{
  "schema_version": "0.1",
  "file_id": "scan_017.pdf",
  "document_type": "invoice",
  "invoice_number": "FA-4102",
  "issue_date": null,
  "purchase_order_reference": "PO-2026-0717",
  "currency": "EUR",
  "supplier": {
    "name": "Suministros Levante S.L.",
    "tax_id": null,
    "location": "Valencia",
    "address": null
  },
  "customer": {
    "name": "Banco Miralmar S.A.",
    "tax_id": "A58231074",
    "location": null,
    "address": null
  },
  "payment": {
    "iban": null
  },
  "lines": [
    {
      "position": 1,
      "description": "Servicio mensual",
      "quantity": null,
      "amount": "820.00"
    },
    {
      "position": 2,
      "description": "Mantenimiento trimestral",
      "quantity": null,
      "amount": "820.00"
    }
  ],
  "taxes": [
    {
      "label": "IVA",
      "rate_percent": "21",
      "amount": "344.40"
    }
  ],
  "totals": {
    "taxable_base": "1640.00",
    "total": "1984.40"
  },
  "annotations": [
    {
      "kind": "footer",
      "text": "Documento generado por el sistema de facturacion del proveedor."
    }
  ],
  "additional_fields": [],
  "issues": [
    {
      "field": "/issue_date",
      "kind": "ambiguous",
      "raw_text": "04/03/2026",
      "candidates": [
        "2026-03-04",
        "2026-04-03"
      ]
    },
    {
      "field": "/payment/iban",
      "kind": "unreadable",
      "raw_text": "ES2100491500051234567890",
      "candidates": [
        "ES2100491500051234567890"
      ]
    },
    {
      "field": "/supplier/tax_id",
      "kind": "unreadable",
      "raw_text": "B46102331",
      "candidates": [
        "B46102331"
      ]
    },
    {
      "field": "/issue_date",
      "kind": "unreadable",
      "raw_text": null,
      "candidates": []
    },
    {
      "field": "/annotations/0/text",
      "kind": "unreadable",
      "raw_text": "Documento generado por el sistema de facturacion del proveedor.",
      "candidates": [
        "Documento generado por el sistema de facturacion del proveedor."
      ]
    }
  ]
}
