{
  "schema_version": "0.1",
  "file_id": "scan_014.pdf",
  "document_type": "invoice",
  "invoice_number": "FA-6328",
  "issue_date": null,
  "purchase_order_reference": "PO-2026-0490",
  "currency": "EUR",
  "supplier": {
    "name": null,
    "tax_id": "B90233808",
    "location": null,
    "address": null
  },
  "customer": {
    "name": "Banco Miralmar S.A.",
    "tax_id": "A58231074",
    "location": null,
    "address": null
  },
  "payment": {
    "iban": "ES9368884400123588900142"
  },
  "lines": [
    {
      "position": 1,
      "description": "Reparaci�n equipo",
      "quantity": null,
      "amount": "590.06"
    },
    {
      "position": 2,
      "description": "Mantenimiento trimestral",
      "quantity": null,
      "amount": "699.33"
    },
    {
      "position": 3,
      "description": "Servicio de limpieza",
      "quantity": null,
      "amount": "896.03"
    }
  ],
  "taxes": [
    {
      "label": "IVA",
      "rate_percent": "21",
      "amount": "458.94"
    }
  ],
  "totals": {
    "taxable_base": "2185.42",
    "total": "2644.36"
  },
  "annotations": [],
  "additional_fields": [],
  "issues": [
    {
      "field": "/supplier/name",
      "kind": "unreadable",
      "raw_text": "Mensajer�a R�pida del Sur S.L.",
      "candidates": [
        "Mensajería Rápida del Sur S.L."
      ]
    },
    {
      "field": "/issue_date",
      "kind": "ambiguous",
      "raw_text": "03/05/2026",
      "candidates": [
        "2026-05-03",
        "2026-03-05"
      ]
    },
    {
      "field": "/lines/0/description",
      "kind": "unreadable",
      "raw_text": "Reparaci�n equipo",
      "candidates": [
        "Reparación equipo"
      ]
    }
  ]
}
