{
  "schema_version": "0.1",
  "file_id": "scan_021.pdf",
  "document_type": "invoice",
  "invoice_number": null,
  "issue_date": "2026-07-14",
  "purchase_order_reference": "PO-2026-0723",
  "currency": "EUR",
  "supplier": {
    "name": "Mensajería Rápida del Sur S.L.",
    "tax_id": null,
    "location": "Málaga",
    "address": null
  },
  "customer": {
    "name": "Banco Miralmar S.A.",
    "tax_id": "A58231074",
    "location": null,
    "address": null
  },
  "payment": {
    "iban": "ES9368884400123588900142"
  },
  "lines": [
    {
      "position": 1,
      "description": "Servicio mensual",
      "quantity": null,
      "amount": "645.00"
    },
    {
      "position": 2,
      "description": "Mantenimiento trimestral",
      "quantity": null,
      "amount": "645.00"
    }
  ],
  "taxes": [
    {
      "label": "IVA",
      "rate_percent": "21",
      "amount": "270.90"
    }
  ],
  "totals": {
    "taxable_base": "1290.00",
    "total": "1560.90"
  },
  "annotations": [
    {
      "kind": "footer",
      "text": "Documento generado por el sistema de facturacion del proveedor."
    }
  ],
  "additional_fields": [],
  "issues": [
    {
      "field": "/supplier/tax_id",
      "kind": "unreadable",
      "raw_text": null,
      "candidates": []
    },
    {
      "field": "/invoice_number",
      "kind": "unreadable",
      "raw_text": null,
      "candidates": []
    }
  ]
}
