{
  "schema_version": "0.1",
  "file_id": "scan_018.pdf",
  "document_type": "invoice",
  "invoice_number": "FA-7788",
  "issue_date": "2026-06-19",
  "purchase_order_reference": "PO-2026-0719",
  "currency": "EUR",
  "supplier": {
    "name": "Transportes Guadaira S.A.",
    "tax_id": "A41220987",
    "location": "Sevilla",
    "address": null
  },
  "customer": {
    "name": "Banco Miralmar S.A.",
    "tax_id": "A58231074",
    "location": null,
    "address": null
  },
  "payment": {
    "iban": "ES5800751120440088123345"
  },
  "lines": [
    {
      "position": 1,
      "description": "Servicio mensual",
      "quantity": null,
      "amount": "826.67"
    },
    {
      "position": 2,
      "description": "Mantenimiento trimestral",
      "quantity": null,
      "amount": "826.67"
    },
    {
      "position": 3,
      "description": "Suministro pedido",
      "quantity": null,
      "amount": "826.66"
    }
  ],
  "taxes": [
    {
      "label": "IVA",
      "rate_percent": "21",
      "amount": "520.80"
    }
  ],
  "totals": {
    "taxable_base": "2480.00",
    "total": "3000.80"
  },
  "annotations": [
    {
      "kind": "footer",
      "text": "Documento generado por el sistema de facturacion del proveedor."
    },
    {
      "kind": "stamp",
      "text": "RECIBIDO\nCONTABILIDAD"
    },
    {
      "kind": "other",
      "text": "Electricidad Montcada S.A.\nNIF: A46990201 · Valencia\nCuenta de abono (IBAN): ES35 2038 5778 9830 0076 5410\nFACTURA Nº F26-2203\nFecha: 07/06/2026\nPedido: PO-2026-0720\nCliente: Banco Miralmar S.A. · CIF: A58231074\nServicio mensual 1.040,00\nMantenimiento trimestral 1.040,00\nSuministro pedido 1.040,00\nBase imponible 3.120,00\nIVA 21% 655,20\nTOTAL 3.775,20 EUR\nURGENTE\nDocumento generado por el sistema de facturacion del proveedor."
    }
  ],
  "additional_fields": [],
  "issues": [
    {
      "field": "/annotations/2/text",
      "kind": "unreadable",
      "raw_text": "Electricidad Montcada S.A.\nNIF: A46990201 · Valencia\nCuenta de abono (IBAN): ES35 2038 5778 9830 0076 5410\nFACTURA Nº F26-2203\nFecha: 07/06/2026\nPedido: PO-2026-0720\nCliente: Banco Miralmar S.A. · CIF: A58231074\nServicio mensual 1.040,00\nMantenimiento trimestral 1.040,00\nSuministro pedido 1.040,00\nBase imponible 3.120,00\nIVA 21% 655,20\nTOTAL 3.775,20 EUR\nURGENTE\nDocumento generado por el sistema de facturacion del proveedor.",
      "candidates": []
    }
  ]
}
