{
  "schema_version": "0.1",
  "file_id": "FA-4666_transportes.pdf",
  "document_type": "invoice",
  "invoice_number": "FA-4666",
  "issue_date": null,
  "purchase_order_reference": "PO-2026-0319",
  "currency": "EUR",
  "supplier": {
    "name": "Transportes Guadaira S.A.",
    "tax_id": "A41220987",
    "location": "Sevilla · España",
    "address": null
  },
  "customer": {
    "name": "Banco Miralmar S.A.",
    "tax_id": "A58231074",
    "location": "Madrid",
    "address": "Paseo de la Castellana 214, Madrid"
  },
  "payment": {
    "iban": "ES7621000813610123456789"
  },
  "lines": [
    {
      "position": 1,
      "description": "Reparación equipo",
      "quantity": "1",
      "amount": "40.68"
    },
    {
      "position": 2,
      "description": "Transporte urgente",
      "quantity": "1",
      "amount": "4026.95"
    }
  ],
  "taxes": [
    {
      "label": "IVA",
      "rate_percent": "21",
      "amount": "854.20"
    }
  ],
  "totals": {
    "taxable_base": "4067.63",
    "total": "4921.83"
  },
  "annotations": [
    {
      "kind": "footer",
      "text": "Documento generado por el sistema de facturacion del proveedor."
    }
  ],
  "additional_fields": [],
  "issues": [
    {
      "field": "/issue_date",
      "kind": "ambiguous",
      "raw_text": "10/01/2026",
      "candidates": [
        "2026-01-10",
        "2026-10-01"
      ]
    }
  ]
}
