{
  "schema_version": "0.1",
  "file_id": "scan_029.pdf",
  "document_type": "invoice",
  "invoice_number": "F26-4408",
  "issue_date": null,
  "purchase_order_reference": "PO-2026-0732",
  "currency": "EUR",
  "supplier": {
    "name": "Mensajería Rápida del Sur S.L.",
    "tax_id": "B90233808",
    "location": "Málaga",
    "address": null
  },
  "customer": {
    "name": "Banco Miralmar S.A.",
    "tax_id": "A58231074",
    "location": null,
    "address": null
  },
  "payment": {
    "iban": "ES6501829977441000332211"
  },
  "lines": [
    {
      "position": 1,
      "description": "Servicio mensual",
      "quantity": null,
      "amount": "683.33"
    },
    {
      "position": 2,
      "description": "Mantenimiento trimestral",
      "quantity": null,
      "amount": "683.33"
    },
    {
      "position": 3,
      "description": "Suministro pedido",
      "quantity": null,
      "amount": "683.34"
    }
  ],
  "taxes": [
    {
      "label": "IVA",
      "rate_percent": "21",
      "amount": "430.50"
    }
  ],
  "totals": {
    "taxable_base": "2050.00",
    "total": "2480.50"
  },
  "annotations": [
    {
      "kind": "footer",
      "text": "Documento generado por el sistema de facturacion del proveedor."
    },
    {
      "kind": "note",
      "text": "NOTA: Nuevo numero de cuenta desde este mes. Rogamos actualicen sus registros."
    }
  ],
  "additional_fields": [],
  "issues": [
    {
      "field": "/issue_date",
      "kind": "ambiguous",
      "raw_text": "06/07/2026",
      "candidates": [
        "2026-07-06",
        "2026-06-07"
      ]
    }
  ]
}
