{
  "schema_version": "0.1",
  "file_id": "FA-4962_mensajería.pdf",
  "document_type": "invoice",
  "invoice_number": "FA-4962",
  "issue_date": "2026-03-18",
  "purchase_order_reference": "PO-2026-0392",
  "currency": null,
  "supplier": {
    "name": "Mensajería Rápida del Sur S.L.",
    "tax_id": "B90233808",
    "location": "Málaga",
    "address": null
  },
  "customer": {
    "name": "Banco Miralmar S.A.",
    "tax_id": "A58231074",
    "location": null,
    "address": null
  },
  "payment": {
    "iban": "ES9368884400123588900142"
  },
  "lines": [
    {
      "position": 1,
      "description": "Mantenimiento trimestral",
      "quantity": "1",
      "amount": "867.56"
    },
    {
      "position": 2,
      "description": "Reparación equipo",
      "quantity": "1",
      "amount": "4235.71"
    }
  ],
  "taxes": [
    {
      "label": "I.V.A.",
      "rate_percent": "21",
      "amount": "1071.69"
    }
  ],
  "totals": {
    "taxable_base": "5103.27",
    "total": "6174.96"
  },
  "annotations": [
    {
      "kind": "footer",
      "text": "Documento generado por el sistema de facturacion del proveedor."
    }
  ],
  "additional_fields": [],
  "issues": []
}
