{
  "schema_version": "0.1",
  "file_id": "FA-5377_electricidad.pdf",
  "document_type": "invoice",
  "invoice_number": "FA-5377",
  "issue_date": null,
  "purchase_order_reference": "PO-2026-0405",
  "currency": null,
  "supplier": {
    "name": "Electricidad Montcada S.A.",
    "tax_id": "A46990201",
    "location": "Valencia",
    "address": null
  },
  "customer": {
    "name": "Banco Miralmar S.A.",
    "tax_id": "A58231074",
    "location": null,
    "address": null
  },
  "payment": {
    "iban": "ES3520385778983000765410"
  },
  "lines": [
    {
      "position": 1,
      "description": "Suministro pedido",
      "quantity": "1",
      "amount": "964.44"
    }
  ],
  "taxes": [
    {
      "label": "I.V.A.",
      "rate_percent": "21",
      "amount": "202.53"
    }
  ],
  "totals": {
    "taxable_base": "964.44",
    "total": "1166.97"
  },
  "annotations": [
    {
      "kind": "footer",
      "text": "Documento generado por el sistema de facturacion del proveedor."
    }
  ],
  "additional_fields": [],
  "issues": [
    {
      "field": "/issue_date",
      "kind": "ambiguous",
      "raw_text": "04/05/2026",
      "candidates": [
        "2026-05-04",
        "2026-04-05"
      ]
    }
  ]
}
