{
  "additional_fields": [],
  "annotations": [
    {
      "kind": "footer",
      "text": "Documento generado por el sistema de facturacion del proveedor."
    },
    {
      "kind": "other",
      "text": "Electricidad Montcada S.A.\nNIF: A46990201 Valencia\nCuenta de abono (IBAN): ES35 2038 5778 9830 0076\nFACTURA Nº F26-2205\nFecha: 07/05/2026\nPedido: PO-2026-0720\nCliente: Banco Miramar S.A. CIF: A58231074\nServicio mensual 1.040,00\nMantenimiento trimestral 1.040,00\nSuministro pedido 1.040,00\nBase imponible 3.120,00\nIVA 21% 655,20\nTOTAL 3.775,20 EUR\nURGENTE\nDocumento generado por el sistema de facturación del proveedor."
    }
  ],
  "currency": "EUR",
  "customer": {
    "address": null,
    "location": null,
    "name": "Banco Miralmar S.A.",
    "tax_id": "A58231074"
  },
  "document_type": "invoice",
  "file_id": "scan_025.pdf",
  "invoice_number": "2026/27401",
  "issue_date": "2026-03-22",
  "issues": [],
  "lines": [
    {
      "amount": "320",
      "description": "Servicio mensual",
      "position": 1,
      "quantity": null
    },
    {
      "amount": "320",
      "description": "Mantenimiento trimestral",
      "position": 2,
      "quantity": null
    }
  ],
  "payment": {
    "iban": "ES4414650100951704302211"
  },
  "purchase_order_reference": "PO-2026-0728",
  "schema_version": "0.1",
  "supplier": {
    "address": null,
    "location": "Valencia",
    "name": "Limpiezas Turia S.L.",
    "tax_id": "B98120774"
  },
  "taxes": [
    {
      "amount": "134.4",
      "label": "IVA",
      "rate_percent": "21"
    }
  ],
  "totals": {
    "taxable_base": "640",
    "total": "774.4"
  }
}
