{
  "additional_fields": [],
  "annotations": [
    {
      "kind": "stamp",
      "text": "OK A"
    },
    {
      "kind": "footer",
      "text": "Documento generado por el sistema de facturación del proveedor"
    },
    {
      "kind": "other",
      "text": "Informática Benimámet S.L.\nCIF: [unreadable]\nCalle de la Paz, 11, 46122 Benimámet (Valencia)\nFACTURA Nº PA-4511\nFecha: 12/07/2020\nFecha, FC-0228/0125 :\nCliente: Banco Santander S.A. [unreadable]\nBase imponible 1.000,00\nSubtotal imponible 1.000,00\nIVA 21% 210,00\nTOTAL 1.374,00 EUR"
    }
  ],
  "currency": "EUR",
  "customer": {
    "address": null,
    "location": null,
    "name": "Banco Miralmar S.A.",
    "tax_id": "A58231074"
  },
  "document_type": "invoice",
  "file_id": "scan_023.pdf",
  "invoice_number": "2026/22608",
  "issue_date": "2026-04-29",
  "issues": [
    {
      "candidates": [],
      "field": "/annotations/1",
      "kind": "unreadable",
      "raw_text": "Documento generado por el sistema de facturación del proveedor"
    },
    {
      "candidates": [],
      "field": "/annotations/2",
      "kind": "unreadable",
      "raw_text": "Informática Benimámet S.L.\nCIF: [unreadable]\nCalle de la Paz, 11, 46122 Benimámet (Valencia)\nFACTURA Nº PA-4511\nFecha: 12/07/2020\nFecha, FC-0228/0125 :\nCliente: Banco Santander S.A. [unreadable]\nBase imponible 1.000,00\nSubtotal imponible 1.000,00\nIVA 21% 210,00\nTOTAL 1.374,00 EUR"
    }
  ],
  "lines": [
    {
      "amount": "683.33",
      "description": "Servicio mensual",
      "position": 1,
      "quantity": null
    },
    {
      "amount": "683.33",
      "description": "Mantenimiento trimestral",
      "position": 2,
      "quantity": null
    },
    {
      "amount": "683.34",
      "description": "Suministro pedido",
      "position": 3,
      "quantity": null
    }
  ],
  "payment": {
    "iban": "ES1800815290070001234567"
  },
  "purchase_order_reference": "PO-2026-0726",
  "schema_version": "0.1",
  "supplier": {
    "address": null,
    "location": "Valencia",
    "name": "Catering Hermanos Pico S.L.",
    "tax_id": "B96233419"
  },
  "taxes": [
    {
      "amount": "430.5",
      "label": "IVA",
      "rate_percent": "21"
    }
  ],
  "totals": {
    "taxable_base": "2050",
    "total": "2480.5"
  }
}
