{
  "schema_version": "0.1",
  "file_id": "scan_027.pdf",
  "document_type": "invoice",
  "invoice_number": "2026/31108",
  "issue_date": null,
  "purchase_order_reference": "PO-2026-0730",
  "currency": "EUR",
  "supplier": {
    "name": "Papelería Ruzafa S.C.",
    "tax_id": "J40112358",
    "location": "Valencia",
    "address": null
  },
  "customer": {
    "name": "Banco Miralmar S.A.",
    "tax_id": "A58231074",
    "location": null,
    "address": null
  },
  "payment": {
    "iban": "ES5531590012348765123407"
  },
  "lines": [
    {
      "position": 1,
      "description": "Servicio mensual",
      "quantity": null,
      "amount": "197.50"
    },
    {
      "position": 2,
      "description": "Mantenimiento trimestral",
      "quantity": null,
      "amount": "197.50"
    }
  ],
  "taxes": [
    {
      "label": "IVA",
      "rate_percent": "21",
      "amount": "82.95"
    }
  ],
  "totals": {
    "taxable_base": "395.00",
    "total": "477.95"
  },
  "annotations": [
    {
      "kind": "footer",
      "text": "Documento generado por el sistema de facturacion del proveedor."
    }
  ],
  "additional_fields": [],
  "issues": [
    {
      "field": "/issue_date",
      "kind": "ambiguous",
      "raw_text": "06/04/2026",
      "candidates": [
        "2026-04-06",
        "2026-06-04"
      ]
    }
  ]
}
