{
  "schema_version": "0.1",
  "file_id": "scan_012.pdf",
  "document_type": "invoice",
  "invoice_number": "2026/96053",
  "issue_date": null,
  "purchase_order_reference": "PO-2026-0488",
  "currency": "EUR",
  "supplier": {
    "name": "Limpiezas Turia S.L.",
    "tax_id": "B98120774",
    "location": null,
    "address": null
  },
  "customer": {
    "name": "Banco Miralmar S.A.",
    "tax_id": "A58231074",
    "location": null,
    "address": null
  },
  "payment": {
    "iban": "ES4414650100951704302211"
  },
  "lines": [
    {
      "position": 1,
      "description": "Transporte urgente",
      "quantity": null,
      "amount": "14.51"
    },
    {
      "position": 2,
      "description": "Material de oficina",
      "quantity": null,
      "amount": "108.80"
    },
    {
      "position": 3,
      "description": "Consumibles",
      "quantity": null,
      "amount": "602.00"
    }
  ],
  "taxes": [
    {
      "label": "IVA",
      "rate_percent": "21",
      "amount": "152.32"
    }
  ],
  "totals": {
    "taxable_base": "725.31",
    "total": "877.63"
  },
  "annotations": [],
  "additional_fields": [],
  "issues": [
    {
      "field": "/issue_date",
      "kind": "ambiguous",
      "raw_text": "06/05/2026",
      "candidates": [
        "2026-05-06",
        "2026-06-05"
      ]
    }
  ]
}
