{
  "schema_version": "0.1",
  "file_id": "FA-4385_informática.pdf",
  "document_type": "invoice",
  "invoice_number": "FA-4385",
  "issue_date": "2026-06-21",
  "purchase_order_reference": "PO-2026-0091",
  "currency": "EUR",
  "supplier": {
    "name": "INFORMÁTICA BENIMÁMET S.L.",
    "tax_id": "B98455101",
    "location": "Valencia",
    "address": null
  },
  "customer": {
    "name": "Banco Miralmar S.A.",
    "tax_id": "A58231074",
    "location": null,
    "address": null
  },
  "payment": {
    "iban": "ES2702390806667122334455"
  },
  "lines": [
    {
      "position": 1,
      "description": "Cuota de servicio",
      "quantity": "1",
      "amount": "2.08"
    },
    {
      "position": 2,
      "description": "Instalación",
      "quantity": "1",
      "amount": "101.96"
    }
  ],
  "taxes": [
    {
      "label": "IVA",
      "rate_percent": "21",
      "amount": "21.85"
    }
  ],
  "totals": {
    "taxable_base": "104.04",
    "total": "125.89"
  },
  "annotations": [
    {
      "kind": "footer",
      "text": "Documento generado por el sistema de facturacion del proveedor."
    }
  ],
  "additional_fields": [],
  "issues": []
}
