{
  "schema_version": "0.1",
  "file_id": "FA-4816_seguridad.pdf",
  "document_type": "invoice",
  "invoice_number": "FA-4816",
  "issue_date": null,
  "purchase_order_reference": "PO-2026-0394",
  "currency": null,
  "supplier": {
    "name": "Seguridad Alcores S.L.",
    "tax_id": "B91455230",
    "location": "Sevilla",
    "address": null
  },
  "customer": {
    "name": "Banco Miralmar S.A.",
    "tax_id": "A58231074",
    "location": null,
    "address": null
  },
  "payment": {
    "iban": "ES0900730100510505331902"
  },
  "lines": [
    {
      "position": 1,
      "description": "Material de oficina",
      "quantity": "1",
      "amount": "760.34"
    },
    {
      "position": 2,
      "description": "Instalación",
      "quantity": "1",
      "amount": "1189.25"
    }
  ],
  "taxes": [
    {
      "label": "I.V.A.",
      "rate_percent": "21",
      "amount": "409.41"
    }
  ],
  "totals": {
    "taxable_base": "1949.59",
    "total": "2359.00"
  },
  "annotations": [
    {
      "kind": "footer",
      "text": "Documento generado por el sistema de facturacion del proveedor."
    }
  ],
  "additional_fields": [],
  "issues": [
    {
      "field": "/issue_date",
      "kind": "ambiguous",
      "raw_text": "07/03/2026",
      "candidates": [
        "2026-03-07",
        "2026-07-03"
      ]
    }
  ]
}
