{
  "schema_version": "0.1",
  "file_id": "FA-5197_papelería.pdf",
  "document_type": "invoice",
  "invoice_number": "FA-5197",
  "issue_date": null,
  "purchase_order_reference": "PO-2026-0286",
  "currency": "EUR",
  "supplier": {
    "name": "Papelería Ruzafa S.C.",
    "tax_id": "J40112358",
    "location": "Valencia · España",
    "address": null
  },
  "customer": {
    "name": "Banco Miralmar S.A.",
    "tax_id": "A58231074",
    "location": "Madrid",
    "address": "Paseo de la Castellana 214, Madrid"
  },
  "payment": {
    "iban": "ES5531590012348765123407"
  },
  "lines": [
    {
      "position": 1,
      "description": "Mantenimiento trimestral",
      "quantity": "1",
      "amount": "2606.67"
    },
    {
      "position": 2,
      "description": "Transporte urgente",
      "quantity": "1",
      "amount": "1075.77"
    },
    {
      "position": 3,
      "description": "Suministro pedido",
      "quantity": "1",
      "amount": "455.13"
    }
  ],
  "taxes": [
    {
      "label": "IVA",
      "rate_percent": "21",
      "amount": "868.89"
    }
  ],
  "totals": {
    "taxable_base": "4137.57",
    "total": "5006.46"
  },
  "annotations": [
    {
      "kind": "footer",
      "text": "Documento generado por el sistema de facturacion del proveedor."
    }
  ],
  "additional_fields": [],
  "issues": [
    {
      "field": "/issue_date",
      "kind": "ambiguous",
      "raw_text": "01/02/2026",
      "candidates": [
        "2026-02-01",
        "2026-01-02"
      ]
    }
  ]
}
