{
  "schema_version": "0.1",
  "file_id": "2026-01-22_P006.pdf",
  "document_type": "invoice",
  "invoice_number": "FA-7141",
  "issue_date": "2026-01-22",
  "purchase_order_reference": "PO-2026-0021",
  "currency": "EUR",
  "supplier": {
    "name": "Electricidad Montcada S.A.",
    "tax_id": "A46990201",
    "location": "Valencia",
    "address": null
  },
  "customer": {
    "name": "Banco Miralmar S.A.",
    "tax_id": "A58231074",
    "location": "Madrid",
    "address": "Paseo de la Castellana 214, Madrid"
  },
  "payment": {
    "iban": "ES3520385778983000765410"
  },
  "lines": [
    {
      "position": 1,
      "description": "Material de oficina",
      "quantity": "1",
      "amount": "374.22"
    },
    {
      "position": 2,
      "description": "Cuota de servicio",
      "quantity": "1",
      "amount": "1595.37"
    }
  ],
  "taxes": [
    {
      "label": "Cuota IVA",
      "rate_percent": "21",
      "amount": "413.61"
    }
  ],
  "totals": {
    "taxable_base": "1969.59",
    "total": "2383.20"
  },
  "annotations": [
    {
      "kind": "footer",
      "text": "Documento generado por el sistema de facturacion del proveedor."
    }
  ],
  "additional_fields": [],
  "issues": []
}
