{
  "schema_version": "0.1",
  "file_id": "FA-4349_electricidad.pdf",
  "document_type": "invoice",
  "invoice_number": "FA-4349",
  "issue_date": "2026-03-17",
  "purchase_order_reference": "PO-2026-0403",
  "currency": "EUR",
  "supplier": {
    "name": "ELECTRICIDAD MONTCADA S.A.",
    "tax_id": "A46990201",
    "location": "Valencia",
    "address": null
  },
  "customer": {
    "name": "Banco Miralmar S.A.",
    "tax_id": "A58231074",
    "location": null,
    "address": null
  },
  "payment": {
    "iban": "ES3520385778983000765410"
  },
  "lines": [
    {
      "position": 1,
      "description": "Mantenimiento trimestral",
      "quantity": "1",
      "amount": "3545.99"
    }
  ],
  "taxes": [
    {
      "label": "IVA",
      "rate_percent": "21",
      "amount": "744.66"
    }
  ],
  "totals": {
    "taxable_base": "3545.99",
    "total": "4290.65"
  },
  "annotations": [
    {
      "kind": "footer",
      "text": "Documento generado por el sistema de facturacion del proveedor."
    }
  ],
  "additional_fields": [],
  "issues": []
}
